[
  {
    "evidence": [
      "web search: Nebraska tech user group",
      "result: Nebraska User Group Conference (Mar 2026), Lincoln USA"
    ],
    "found_via": "web_search",
    "last_evaluated": "2026-10-22T00:34:52Z",
    "reason": "awaiting evaluation",
    "result": "pending",
    "url": "https://10times.com/e1h0-s9f2-f6dk-h"
  },
  {
    "evidence": [
      "web search: Nebraska networking meetup",
      "result: Networking Opportunities"
    ],
    "found_via": "web_search",
    "last_evaluated": "2026-10-22T00:34:52Z",
    "reason": "awaiting evaluation",
    "result": "pending",
    "url": "https://aafnebraska.org/engage/networking-opportunities"
  },
  {
    "evidence": [
      "web search: Lincoln networking user group",
      "result: ABLE Lincoln - Business Leaders and Entrepreneurs"
    ],
    "found_via": "web_search",
    "last_evaluated": "2026-10-22T00:34:52Z",
    "reason": "no calendar feed, event data or RSS/Atom feed found",
    "result": "needs_review",
    "url": "https://able-lincoln.com/"
  },
  {
    "evidence": [
      "web search: Nebraska networking user group",
      "result: Sign In or Create Your Account Today – Microsoft"
    ],
    "found_via": "web_search",
    "last_evaluated": "2026-10-22T00:34:52Z",
    "reason": "awaiting evaluation",
    "result": "pending",
    "url": "https://account.microsoft.com/account"
  },
  {
    "evidence": [
      "web search: Lincoln tech conference",
      "result: ACTE's National Work-Based Learning Conference 2026: Lincoln Tech High School Share, Career C..."
    ],
    "found_via": "web_search",
    "last_evaluated": "2026-10-22T00:34:52Z",
    "reason": "awaiting evaluation",
    "result": "pending",
    "url": "https://actesnwbls2026.sched.com/event/2JHsf/lincoln-tech-high-school-share-career-connected-early-college-for-the-trades"
  },
  {
    "evidence": [
      "gap check: known group with no source: \"AI Tinkerers Lincoln/Omaha\" Lincoln",
      "result: AI Tinkerers | Global AI Events & Meetups 2026"
    ],
    "found_via": "gap",
    "last_evaluated": "2026-10-22T00:34:52Z",
    "reason": "no calendar feed, event data or RSS/Atom feed found",
    "result": "needs_review",
    "url": "https://aitinkerers.org/all_cities"
  },
  {
    "evidence": [
      "web search: Nebraska tech user group",
      "result: NTC - Aksarben Foundation"
    ],
    "found_via": "web_search",
    "last_evaluated": "2026-10-22T00:34:52Z",
    "reason": "awaiting evaluation",
    "result": "pending",
    "url": "https://aksarben.org/ntc"
  },
  {
    "evidence": [
      "web search: Lincoln data meetup",
      "result: Meetups in Lincoln | Networking & Community Groups",
      "sample: 1 of 15 upcoming events relevant (2026-10-22)"
    ],
    "found_via": "web_search",
    "last_evaluated": "2026-10-22T00:34:52Z",
    "reason": "relevant Nebraska tech events",
    "result": "added",
    "url": "https://allevents.in/lincoln/meetups"
  },
  {
    "evidence": [
      "web search: Nebraska data meetup",
      "result: All Things Nebraska"
    ],
    "found_via": "web_search",
    "last_evaluated": "2026-10-22T00:34:52Z",
    "reason": "awaiting evaluation",
    "result": "pending",
    "url": "https://allthingsnebraska.unl.edu/"
  },
  {
    "evidence": [
      "web search: Nebraska networking user group",
      "result: Microsoft Store - Download apps, games & more for your Windows PC"
    ],
    "found_via": "web_search",
    "last_evaluated": "2026-10-22T00:34:52Z",
    "reason": "awaiting evaluation",
    "result": "pending",
    "url": "https://apps.microsoft.com/home"
  },
  {
    "evidence": [
      "web search: Omaha AI meetup",
      "result: AI O.NE"
    ],
    "found_via": "web_search",
    "last_evaluated": "2026-10-21T02:04:10Z",
    "reason": "no calendar feed, event data or RSS/Atom feed found",
    "result": "needs_review",
    "url": "https://autogrator.com/ai-o-ne"
  },
  {
    "evidence": [
      "web search: Lincoln DevOps user group",
      "result: Azure DevOps | Microsoft Azure"
    ],
    "found_via": "web_search",
    "last_evaluated": "2026-10-22T00:34:52Z",
    "reason": "no calendar feed, event data or RSS/Atom feed found",
    "result": "needs_review",
    "url": "https://azure.microsoft.com/en-us/products/devops"
  },
  {
    "evidence": [
      "web search: Nebraska cloud user group",
      "result: Nebraska User Group Spring Conference - Communities"
    ],
    "found_via": "web_search",
    "last_evaluated": "2026-10-22T00:34:52Z",
    "reason": "awaiting evaluation",
    "result": "pending",
    "url": "https://bentleysystems.service-now.com/community"
  },
  {
    "evidence": [
      "web search: Nebraska cloud user group",
      "result: Nebraska Users Group (NEUG) | Point Cloud Processing ..."
    ],
    "found_via": "web_search",
    "last_evaluated": "2026-10-22T00:34:52Z",
    "reason": "awaiting evaluation",
    "result": "pending",
    "url": "https://blog.topodot.com/event/nebraska-users-group-neug"
  },
  {
    "evidence": [
      "web search: Lincoln IT user group",
      "result: Lincoln .NET User Group–On the Road with Prism",
      "sample: 0 of 0 upcoming events relevant (2026-10-22)"
    ],
    "found_via": "web_search",
    "last_evaluated": "2026-10-22T00:34:52Z",
    "reason": "no upcoming events to judge it by",
    "result": "needs_review",
    "url": "https://brianlagunas.com/lincoln-net-user-groupon-the-road-with-prism"
  },
  {
    "evidence": [
      "gap check: known group with no source: \"BSides Omaha\" Omaha",
      "result: Chapters – BSides Global Community",
      "sample: 0 of 20 upcoming events relevant (2026-10-22)"
    ],
    "found_via": "gap",
    "last_evaluated": "2026-10-22T00:34:52Z",
    "reason": "its events need a person to judge",
    "result": "needs_review",
    "url": "https://bsides.org/chapters"
  },
  {
    "evidence": [
      "gap check: known group with no source: \"AIM Institute\" Omaha",
      "result: AIM Institute Careers and Employment"
    ],
    "found_via": "gap",
    "last_evaluated": "2026-10-22T00:34:52Z",
    "reason": "no calendar feed, event data or RSS/Atom feed found",
    "result": "needs_review",
    "url": "https://careers.nonprofitam.org/company/aim-institute-0012-c3"
  },
  {
    "evidence": [
      "web search: Omaha tech hackathon",
      "result: Omaha Tech Summit"
    ],
    "found_via": "web_search",
    "last_evaluated": "2026-10-22T00:34:52Z",
    "reason": "awaiting evaluation",
    "result": "pending",
    "url": "https://choicesolutions.com/event/omaha-tech-summit"
  },
  {
    "evidence": [
      "web search: Lincoln programming meetup",
      "result: Code & Coffee Meetup Community | Developer meetups to make friends and grow"
    ],
    "found_via": "web_search",
    "last_evaluated": "2026-10-22T00:34:52Z",
    "reason": "no calendar feed, event data or RSS/Atom feed found",
    "result": "needs_review",
    "url": "https://codeandcoffee.org/"
  },
  {
    "evidence": [
      "web search: Lincoln programming user group",
      "result: codeLinc 10 with Lincoln Financial & AWS: Showcase your development skills to solve real-world technical challenges - TRAVEL REIMBURSEMENT available - Devpost"
    ],
    "found_via": "web_search",
    "last_evaluated": "2026-10-22T00:34:52Z",
    "reason": "page returned HTTP 403",
    "result": "needs_review",
    "url": "https://codelinc10.devpost.com/"
  },
  {
    "evidence": [
      "web search: Omaha cloud user group",
      "result: Omaha - Fabric User Groups"
    ],
    "found_via": "web_search",
    "last_evaluated": "2026-10-22T00:34:52Z",
    "reason": "page returned HTTP 403",
    "result": "needs_review",
    "url": "https://community.fabric.microsoft.com/t5/Microsoft-Fabric-User-Group/gh-p/MicrosoftFabricUserGroup-Omaha"
  },
  {
    "evidence": [
      "linked from https://owasp.org/chapters/omaha",
      "link text: OWASP Community"
    ],
    "found_via": "link_graph",
    "last_evaluated": "2026-10-22T00:34:52Z",
    "reason": "no calendar feed, event data or RSS/Atom feed found",
    "result": "needs_review",
    "url": "https://community.owasp.org/"
  },
  {
    "evidence": [
      "web search: Nebraska programming user group",
      "result: Student Organizations | School of Computing | Nebraska"
    ],
    "found_via": "web_search",
    "last_evaluated": "2026-10-22T00:34:52Z",
    "reason": "awaiting evaluation",
    "result": "pending",
    "url": "https://computing.unl.edu/student-organizations"
  },
  {
    "evidence": [
      "web search: Nebraska cybersecurity user group",
      "result: Cybersecurity Company in Nebraska"
    ],
    "found_via": "web_search",
    "last_evaluated": "2026-10-22T00:34:52Z",
    "reason": "awaiting evaluation",
    "result": "pending",
    "url": "https://cybergl.com/nebraska"
  },
  {
    "evidence": [
      "web search: Omaha cybersecurity meetup",
      "result: Omaha's Cybersecurity Community"
    ],
    "found_via": "web_search",
    "last_evaluated": "2026-10-21T02:04:10Z",
    "reason": "no calendar feed, event data or RSS/Atom feed found",
    "result": "needs_review",
    "url": "https://cybersecurityomaha.com/community"
  },
  {
    "evidence": [
      "gap check: known group with no source: \"WiCyS Nebraska\" Nebraska",
      "result: WiCyS (Women In CyberSecurity)"
    ],
    "found_via": "gap",
    "last_evaluated": "2026-10-22T00:34:52Z",
    "reason": "awaiting evaluation",
    "result": "pending",
    "url": "https://cybersecurityventures.com/about-wicys"
  },
  {
    "evidence": [
      "web search: Lincoln data user group",
      "result: Nebraska, USA – Google Data Center Location",
      "sample: 0 of 0 upcoming events relevant (2026-10-22)"
    ],
    "found_via": "web_search",
    "last_evaluated": "2026-10-22T00:34:52Z",
    "reason": "no upcoming events to judge it by",
    "result": "needs_review",
    "url": "https://datacenters.google/locations/nebraska"
  },
  {
    "evidence": [